{
  "schema_version": "afsim_ir_v1",
  "scenario": {
    "name": "escort_air_mission",
    "description": "Escort mission protecting a high-value asset.",
    "duration": {
      "value": 420,
      "unit": "sec"
    },
    "domains": [
      "air"
    ],
    "outputs": [
      "event_pipe"
    ]
  },
  "sides": [
    {
      "id": "blue",
      "display_name": "Blue"
    },
    {
      "id": "red",
      "display_name": "Red"
    }
  ],
  "locations": [
    {
      "id": "escort_origin",
      "kind": "point",
      "position": {
        "lat": "30.60n",
        "lon": "104.00e",
        "altitude": {
          "value": 3500,
          "unit": "m"
        }
      }
    },
    {
      "id": "hvaa_origin",
      "kind": "point",
      "position": {
        "lat": "30.58n",
        "lon": "104.03e",
        "altitude": {
          "value": 3400,
          "unit": "m"
        }
      }
    },
    {
      "id": "threat_origin",
      "kind": "point",
      "position": {
        "lat": "30.95n",
        "lon": "104.40e",
        "altitude": {
          "value": 3600,
          "unit": "m"
        }
      }
    }
  ],
  "routes": [
    {
      "id": "escort_route",
      "kind": "transit",
      "waypoints": [
        {
          "location_ref": "escort_origin",
          "speed": {
            "value": 220,
            "unit": "m/sec"
          }
        },
        {
          "position": {
            "lat": "30.80n",
            "lon": "104.20e",
            "altitude": {
              "value": 3600,
              "unit": "m"
            }
          },
          "speed": {
            "value": 220,
            "unit": "m/sec"
          }
        }
      ]
    },
    {
      "id": "hvaa_route",
      "kind": "transit",
      "waypoints": [
        {
          "location_ref": "hvaa_origin",
          "speed": {
            "value": 180,
            "unit": "m/sec"
          }
        },
        {
          "position": {
            "lat": "30.78n",
            "lon": "104.18e",
            "altitude": {
              "value": 3400,
              "unit": "m"
            }
          },
          "speed": {
            "value": 180,
            "unit": "m/sec"
          }
        }
      ]
    }
  ],
  "components": {
    "movers": [
      {
        "id": "escort_mover",
        "role": "air_mover",
        "type_hint": "air_mover"
      }
    ],
    "weapons": [
      {
        "id": "escort_aam",
        "role": "air_to_air_weapon",
        "type_hint": "air_to_air_missile"
      }
    ],
    "processors": [
      {
        "id": "escort_behavior",
        "role": "escort_behavior",
        "type_hint": "escort_processor"
      }
    ],
    "comms": [
      {
        "id": "escort_comm",
        "role": "escort_coordination",
        "type_hint": "datalink"
      }
    ]
  },
  "entities": [
    {
      "id": "escort_flight",
      "role": "escort_fighter",
      "side": "blue",
      "quantity": 2,
      "domain": "air",
      "platform_type_hint": "fighter_aircraft",
      "component_refs": [
        "escort_mover",
        "escort_aam",
        "escort_behavior",
        "escort_comm"
      ],
      "initial_location_ref": "escort_origin",
      "route_ref": "escort_route"
    },
    {
      "id": "protected_asset",
      "role": "hvaa",
      "side": "blue",
      "quantity": 1,
      "domain": "air",
      "platform_type_hint": "transport_or_hvaa_aircraft",
      "component_refs": [
        "escort_mover",
        "escort_comm"
      ],
      "initial_location_ref": "hvaa_origin",
      "route_ref": "hvaa_route"
    },
    {
      "id": "red_attackers",
      "role": "attacker",
      "side": "red",
      "quantity": 2,
      "domain": "air",
      "platform_type_hint": "fighter_aircraft",
      "component_refs": [
        "escort_mover",
        "escort_aam"
      ],
      "initial_location_ref": "threat_origin"
    }
  ],
  "tasks": [
    {
      "id": "escort_hvaa",
      "type": "escort",
      "assignee_refs": [
        "escort_flight"
      ],
      "target_refs": [
        "protected_asset"
      ],
      "parameters": {
        "protection_radius": {
          "value": 20,
          "unit": "km"
        }
      }
    },
    {
      "id": "attack_hvaa",
      "type": "air_attack",
      "assignee_refs": [
        "red_attackers"
      ],
      "target_refs": [
        "protected_asset"
      ],
      "parameters": {
        "intent": "intercept_hvaa"
      }
    }
  ],
  "constraints": {
    "unit_system": "afsim_mixed",
    "coordinate_format": "lat_lon_dir",
    "required_fields": [
      "entities.quantity",
      "entities.side",
      "routes",
      "tasks"
    ]
  },
  "expected_events": [
    {
      "id": "escort_protection_established",
      "type": "escort_state",
      "actor_refs": [
        "escort_flight",
        "protected_asset"
      ],
      "success_condition": "Escort fighters remain associated with the protected asset."
    }
  ]
}
