{
  "schema_version": "afsim_ir_v1",
  "scenario": {
    "name": "lunar_orbiter_scenario",
    "description": "Cislunar lunar orbiter scenario.",
    "duration": {
      "value": 3600,
      "unit": "sec"
    },
    "domains": [
      "space"
    ],
    "outputs": [
      "event_pipe"
    ]
  },
  "sides": [
    {
      "id": "blue",
      "display_name": "Blue"
    }
  ],
  "locations": [
    {
      "id": "lunar_orbit_start",
      "kind": "point",
      "position": {
        "lat": "0n",
        "lon": "0e",
        "altitude": {
          "value": 100,
          "unit": "km"
        }
      }
    }
  ],
  "routes": [
    {
      "id": "lunar_orbit",
      "kind": "orbit",
      "loop": true,
      "waypoints": [
        {
          "position": {
            "lat": "0n",
            "lon": "0e",
            "altitude": {
              "value": 100,
              "unit": "km"
            }
          }
        },
        {
          "position": {
            "lat": "0n",
            "lon": "90e",
            "altitude": {
              "value": 100,
              "unit": "km"
            }
          }
        },
        {
          "position": {
            "lat": "0n",
            "lon": "180e",
            "altitude": {
              "value": 100,
              "unit": "km"
            }
          }
        },
        {
          "position": {
            "lat": "0n",
            "lon": "90w",
            "altitude": {
              "value": 100,
              "unit": "km"
            }
          }
        }
      ]
    }
  ],
  "components": {
    "movers": [
      {
        "id": "cislunar_mover",
        "role": "orbital_mover",
        "type_hint": "space_mover"
      }
    ]
  },
  "entities": [
    {
      "id": "lunar_orbiter",
      "role": "orbiter",
      "side": "blue",
      "quantity": 1,
      "domain": "space",
      "platform_type_hint": "lunar_orbiter",
      "component_refs": [
        "cislunar_mover"
      ],
      "initial_location_ref": "lunar_orbit_start",
      "route_ref": "lunar_orbit"
    }
  ],
  "tasks": [
    {
      "id": "maintain_lunar_orbit",
      "type": "orbit_maintenance",
      "assignee_refs": [
        "lunar_orbiter"
      ]
    }
  ],
  "constraints": {
    "unit_system": "afsim_mixed",
    "coordinate_format": "lat_lon_dir",
    "required_fields": [
      "entities.quantity",
      "entities.side",
      "tasks"
    ]
  },
  "expected_events": [
    {
      "id": "orbit_established",
      "type": "orbit_entry",
      "actor_refs": [
        "lunar_orbiter"
      ],
      "success_condition": "The orbiter enters and maintains a circular lunar orbit."
    }
  ]
}
